<?xml version="1.0" encoding="UTF-8"?>
<!--Knowledge Rules project ( Copyright under GPLv3 by Stichting Deltares ) -->
<schema xmlns:AutXML="http://www.wldelft.nl/fews" xmlns="http://www.w3.org/2001/XMLSchema" xmlns:xlink="http://www.w3.org/1999/xlink" targetNamespace="http://www.wldelft.nl/fews" elementFormDefault="qualified" attributeFormDefault="unqualified" version="1.0">
	<element name="AutecologyXML" type="AutXML:AutecologyXMLConfigComplexType"/>
	<complexType name="AutecologyXMLConfigComplexType">
		<sequence>
			<element name="Topic" type="AutXML:TopicComplexType" minOccurs="0">
				<annotation>
					<documentation>Optional provision of input files, if provided ALL relevant input files needs to be defined, if not, the program will check for files with default naming in the current working folder</documentation>
				</annotation>
			</element>
			<element name="Autecology" type="AutXML:AutecologyComplexType" minOccurs="0">
				<annotation>
					<documentation>Optional provision of input files, if provided ALL relevant input files needs to be defined, if not, the program will check for files with default naming in the current working folder</documentation>
				</annotation>
			</element>
			<element name="ContentDescription" type="AutXML:CDComplexType" minOccurs="0">
				<annotation>
					<documentation>Optional provision of input files, if provided ALL relevant input files needs to be defined, if not, the program will check for files with default naming in the current working folder</documentation>
				</annotation>
			</element>
			<element name="Documentation" type="AutXML:DocumentationComplexType" minOccurs="0">
				<annotation>
					<documentation>Optional provision of input files, if provided ALL relevant input files needs to be defined, if not, the program will check for files with default naming in the current working folder</documentation>
				</annotation>
			</element>
			<element name="DataSources" type="AutXML:DataSourcesComplexType" minOccurs="0">
				<annotation>
					<documentation>Optional provision of input files, if provided ALL relevant input files needs to be defined, if not, the program will check for files with default naming in the current working folder</documentation>
				</annotation>
			</element>
		</sequence>
	</complexType>
	<complexType name="TopicComplexType">
		<choice>
			<element name="Species" type="AutXML:SpeciesComplexType">
				<annotation>
					<documentation>Optional provision of input files, if provided ALL relevant input files needs to be defined, if not, the program will check for files with default naming in the current working folder</documentation>
				</annotation>
			</element>
			<element name="WFDindicator" type="AutXML:WFDIComplexType">
				<annotation>
					<documentation>Optional provision of input files, if provided ALL relevant input files needs to be defined, if not, the program will check for files with default naming in the current working folder</documentation>
				</annotation>
			</element>
		</choice>
	</complexType>
	<complexType name="SpeciesComplexType">
		<sequence>
			<element name="EoLpagenr" type="AutXML:ExternalIntegerSimpleType">
				<annotation>
					<documentation>Optional provision of input files, if provided ALL relevant input files needs to be defined, if not, the program will check for files with default naming in the current working folder</documentation>
				</annotation>
			</element>
			<element name="LatName" type="string">
				<annotation>
					<documentation>Optional provision of input files, if provided ALL relevant input files needs to be defined, if not, the program will check for files with default naming in the current working folder</documentation>
				</annotation>
			</element>
			<element name="CommonNames" type="AutXML:CommonNamesComplexType">
				<annotation>
					<documentation>Optional provision of input files, if provided ALL relevant input files needs to be defined, if not, the program will check for files with default naming in the current working folder</documentation>
				</annotation>
			</element>
			<choice>
				<element name="SpecCode" type="string" minOccurs="0">
					<annotation>
						<documentation>Optional provision of input files, if provided ALL relevant input files needs to be defined, if not, the program will check for files with default naming in the current working folder</documentation>
					</annotation>
				</element>
			</choice>
		</sequence>
	</complexType>
	<complexType name="WFDIComplexType">
		<sequence>
			<element name="CommonNames" type="AutXML:CommonNamesComplexType">
				<annotation>
					<documentation>Optional provision of input files, if provided ALL relevant input files needs to be defined, if not, the program will check for files with default naming in the current working folder</documentation>
				</annotation>
			</element>
		</sequence>
	</complexType>
	<complexType name="AutecologyComplexType">
		<sequence>
			<element name="ModelType" type="AutXML:ModelTypeComplexType" maxOccurs="unbounded">
				<annotation>
					<documentation>Optional provision of input files, if provided ALL relevant input files needs to be defined, if not, the program will check for files with default naming in the current working folder</documentation>
				</annotation>
			</element>
		</sequence>
	</complexType>
	<complexType name="ModelTypeComplexType">
		<sequence>
			<element name="System" type="AutXML:SystemComplexType" maxOccurs="unbounded">
				<annotation>
					<documentation>Optional provision of input files, if provided ALL relevant input files needs to be defined, if not, the program will check for files with default naming in the current working folder</documentation>
				</annotation>
			</element>
		</sequence>
		<attribute name="name" type="string" use="required"/>
	</complexType>
	<complexType name="SystemComplexType">
		<sequence>
			<element name="Scope" type="AutXML:ScopeComplexType">
				<annotation>
					<documentation>Optional provision of input files, if provided ALL relevant input files needs to be defined, if not, the program will check for files with default naming in the current working folder</documentation>
				</annotation>
			</element>
			<element name="SystemDescription" type="AutXML:CDComplexType">
				<annotation>
					<documentation>Optional provision of input files, if provided ALL relevant input files needs to be defined, if not, the program will check for files with default naming in the current working folder</documentation>
				</annotation>
			</element>
			<element name="SystemFlowDiagrams" type="AutXML:SystemFlowDiagramsComplexType">
				<annotation>
					<documentation>Optional provision of input files, if provided ALL relevant input files needs to be defined, if not, the program will check for files with default naming in the current working folder</documentation>
				</annotation>
			</element>
			<element name="KnowledgeRules" type="AutXML:KnowledgeRulesComplexType">
				<annotation>
					<documentation>Optional provision of input files, if provided ALL relevant input files needs to be defined, if not, the program will check for files with default naming in the current working folder</documentation>
				</annotation>
			</element>
		</sequence>
		<attribute name="name" type="string" use="required"/>
	</complexType>
	<complexType name="ScopeComplexType">
		<sequence>
			<element name="SpatialScope" type="AutXML:SpatialScopeComplexType">
				<annotation>
					<documentation>Optional provision of input files, if provided ALL relevant input files needs to be defined, if not, the program will check for files with default naming in the current working folder</documentation>
				</annotation>
			</element>
			<element name="TemporalScope" type="AutXML:TemporalScopeComplexType">
				<annotation>
					<documentation>Optional provision of input files, if provided ALL relevant input files needs to be defined, if not, the program will check for files with default naming in the current working folder</documentation>
				</annotation>
			</element>
		</sequence>
	</complexType>
	<complexType name="SpatialScopeComplexType">
		<sequence>
			<element name="GeoNames" type="AutXML:GeoNamesComplexType" maxOccurs="unbounded">
				<annotation>
					<documentation>Optional provision of input files, if provided ALL relevant input files needs to be defined, if not, the program will check for files with default naming in the current working folder</documentation>
				</annotation>
			</element>
		</sequence>
	</complexType>
	<complexType name="GeoNamesComplexType">
		<attribute name="name" type="string" use="required"/>
		<attribute name="id" type="integer" use="required"/>
	</complexType>
	<complexType name="TemporalScopeComplexType">
		<sequence>
			<element name="StartDate" type="AutXML:dateType">
				<annotation>
					<documentation>Optional provision of input files, if provided ALL relevant input files needs to be defined, if not, the program will check for files with default naming in the current working folder</documentation>
				</annotation>
			</element>
			<element name="EndDate" type="AutXML:dateType">
				<annotation>
					<documentation>Optional provision of input files, if provided ALL relevant input files needs to be defined, if not, the program will check for files with default naming in the current working folder</documentation>
				</annotation>
			</element>
		</sequence>
	</complexType>
	<complexType name="SystemFlowDiagramsComplexType">
		<sequence>
			<element name="FlowDiagram" type="AutXML:FlowDiagramComplexType" maxOccurs="unbounded">
				<annotation>
					<documentation>Optional provision of input files, if provided ALL relevant input files needs to be defined, if not, the program will check for files with default naming in the current working folder</documentation>
				</annotation>
			</element>
		</sequence>
	</complexType>
	<complexType name="FlowDiagramComplexType">
		<sequence>
			<element name="From" type="AutXML:LinkFromComplexType" minOccurs="0" maxOccurs="unbounded">
				<annotation>
					<documentation>Optional provision of input files, if provided ALL relevant input files needs to be defined, if not, the program will check for files with default naming in the current working folder</documentation>
				</annotation>
			</element>
		</sequence>
		<attribute name="name" type="string" use="required"/>
	</complexType>
	<complexType name="KnowledgeRulesComplexType">
		<sequence>
			<choice minOccurs="0" maxOccurs="unbounded">
				<element name="ResponseCurve" type="AutXML:ResponseCurveComplexType" minOccurs="0" maxOccurs="unbounded">
					<annotation>
						<documentation>Optional provision of input files, if provided ALL relevant input files needs to be defined, if not, the program will check for files with default naming in the current working folder</documentation>
					</annotation>
				</element>
				<element name="FormulaBased" type="AutXML:FormulaBasedComplexType" minOccurs="0" maxOccurs="unbounded">
					<annotation>
						<documentation>Optional provision of input files, if provided ALL relevant input files needs to be defined, if not, the program will check for files with default naming in the current working folder</documentation>
					</annotation>
				</element>
			</choice>
		</sequence>
	</complexType>
	<complexType name="ResponseCurveComplexType">
		<sequence>
			<element name="type" type="AutXML:TypeSingleType" minOccurs="1" maxOccurs="1"/>
			<element name="layername" type="string" minOccurs="1" maxOccurs="1"/>
			<element name="unit" type="string" minOccurs="1" maxOccurs="1"/>
			<element name="statistic" type="string" minOccurs="1" maxOccurs="1"/>
			<element name="description" type="string" minOccurs="1" maxOccurs="1"/>
			<element name="author" type="string" minOccurs="1" maxOccurs="1"/>
			<element name="date" type="AutXML:dateType" minOccurs="1" maxOccurs="1"/>
			<element name="references" type="AutXML:ReferencesComplexType" minOccurs="1" maxOccurs="1"/>
			<choice>
				<element name="valuesScalar" type="AutXML:RCValuesScalarComplexType" minOccurs="1" maxOccurs="1"/>
				<element name="valuesCategorical" type="AutXML:RCValuesCategoricalComplexType" minOccurs="1" maxOccurs="1"/>
				<element name="valuesRangeCategorical" type="AutXML:RCValuesRangeCategoricalComplexType" minOccurs="1" maxOccurs="1"/>
				<element name="valuesRanges" type="AutXML:RCValuesRangesComplexType" minOccurs="1" maxOccurs="1"/>
			</choice>
		</sequence>
		<attribute name="name" type="string" use="required"/>
	</complexType>
	<complexType name="FormulaBasedComplexType">
		<sequence>
			<element name="layername" type="string" minOccurs="1" maxOccurs="1"/>
			<element name="unit" type="string" minOccurs="1" maxOccurs="1"/>
			<element name="statistic" type="string" minOccurs="1" maxOccurs="1"/>
			<element name="description" type="string" minOccurs="1" maxOccurs="1"/>
			<element name="author" type="string" minOccurs="1" maxOccurs="1"/>
			<element name="date" type="AutXML:dateType" minOccurs="1" maxOccurs="1"/>
			<element name="references" type="AutXML:ReferencesComplexType" minOccurs="1" maxOccurs="1"/>
			<element name="output" type="string" minOccurs="1" maxOccurs="1"/>
			<element name="equation" type="string" minOccurs="1" maxOccurs="1"/>
			<element name="Parameters" type="AutXML:FBParametersComplexType" minOccurs="1" maxOccurs="1"/>
		</sequence>
		<attribute name="name" type="string" use="required"/>
	</complexType>
	<complexType name="ReferencesComplexType">
		<sequence>
			<element name="reference" type="AutXML:ReferenceComplexType" maxOccurs="unbounded"/>
		</sequence>
	</complexType>
	<complexType name="FBParametersComplexType">
		<sequence>
			<element name="valuesConstant" type="AutXML:FBConstantValuesComplexType" minOccurs="0" maxOccurs="unbounded"/>
			<element name="valuesScalar" type="AutXML:FBScalarValuesComplexType" minOccurs="0" maxOccurs="unbounded"/>
		</sequence>
	</complexType>
	<complexType name="RCValuesScalarComplexType">
		<sequence>
			<element name="parameter" type="AutXML:ParameterScalarRCComplexType" maxOccurs="unbounded"/>
		</sequence>
	</complexType>
	<complexType name="RCValuesCategoricalComplexType">
		<sequence>
			<element name="parameter" type="AutXML:ParameterCategoricalRCComplexType" maxOccurs="unbounded"/>
		</sequence>
	</complexType>
	<complexType name="RCValuesRangeCategoricalComplexType">
		<sequence>
			<element name="parameter" type="AutXML:ParameterRangeCategoricalRCComplexType" maxOccurs="unbounded"/>
		</sequence>
	</complexType>
	<complexType name="RCValuesRangesComplexType">
		<sequence>
			<element name="parameter" type="AutXML:ParameterRangesRCComplexType" maxOccurs="unbounded"/>
		</sequence>
	</complexType>
	<complexType name="FBConstantValuesComplexType">
		<sequence>
			<element name="parameter" type="AutXML:ParameterConstantFBComplexType" maxOccurs="unbounded"/>
		</sequence>
		<attribute name="dataname" type="string" use="required"/>
		<attribute name="type" type="string" use="required" fixed="constant"/>
		<attribute name="unit" type="string" use="required"/>
	</complexType>
	<complexType name="FBScalarValuesComplexType">
		<sequence>
			<element name="parameter" type="AutXML:ParameterScalarFBComplexType" maxOccurs="unbounded"/>
		</sequence>
		<attribute name="dataname" type="string" use="required"/>
		<attribute name="type" type="string" use="required" fixed="scalar"/>
		<attribute name="unit" type="string" use="required"/>
	</complexType>
	<complexType name="ParameterConstantFBComplexType">
		<attribute name="constantset" type="string" use="required"/>
		<attribute name="value" type="string" use="required"/>
	</complexType>
	<complexType name="ParameterScalarFBComplexType">
		<attribute name="min" type="string" use="required"/>
		<attribute name="max" type="string" use="required"/>
	</complexType>
	<complexType name="ParameterScalarRCComplexType">
		<attribute name="value" type="string" use="required"/>
		<attribute name="HSI" type="string" use="required"/>
	</complexType>
	<complexType name="ParameterCategoricalRCComplexType">
		<attribute name="cat" type="string" use="required"/>
		<attribute name="HSI" type="string" use="required"/>
	</complexType>
	<complexType name="ParameterRangeCategoricalRCComplexType">
		<attribute name="rangemin" type="string" use="required"/>
		<attribute name="rangemax" type="string" use="required"/>
		<attribute name="cat" type="string" use="required"/>
		<attribute name="HSI" type="string" use="required"/>
	</complexType>
	<complexType name="ParameterRangesRCComplexType">
		<attribute name="rangemin" type="string" use="required"/>
		<attribute name="rangemax" type="string" use="required"/>
		<attribute name="HSI" type="string" use="required"/>
	</complexType>
	<complexType name="CDComplexType">
		<sequence>
			<element name="Description" type="AutXML:DescriptionComplexType" maxOccurs="unbounded"/>
		</sequence>
	</complexType>
	<complexType name="DocumentationComplexType">
		<sequence>
			<element name="reference" type="AutXML:ReferenceComplexType" maxOccurs="unbounded"/>
		</sequence>
	</complexType>
	<complexType name="DataSourcesComplexType"/>
	<complexType name="CommonNamesComplexType">
		<sequence>
			<element name="Name" type="AutXML:NameComplexType" maxOccurs="unbounded"/>
		</sequence>
	</complexType>
	<complexType name="NameComplexType">
		<attribute name="name" type="string" use="required"/>
		<attribute name="language" type="string" use="required"/>
	</complexType>
	<complexType name="DescriptionComplexType">
		<sequence>
			<element name="text" type="string"/>
		</sequence>
		<attribute name="language" type="string" use="required"/>
	</complexType>
	<complexType name="LinkFromComplexType">
		<sequence>
			<element name="label" type="string"/>
			<element name="equation" type="AutXML:LinkEquationSimpleType"/>
			<element name="specific_equation" type="string" minOccurs="0"/>
			<element name="To" type="string" maxOccurs="unbounded"/>
		</sequence>
		<attribute name="name" type="string" use="required"/>
	</complexType>
	<simpleType name="LinkEquationSimpleType">
		<restriction base="string">
			<enumeration value="average"/>
			<enumeration value="min"/>
			<enumeration value="max"/>
			<enumeration value="geometric_average"/>
			<enumeration value="specific"/>
		</restriction>
	</simpleType>
	<complexType name="ReferenceComplexType">
		<choice>
			<element name="html" type="string" minOccurs="0"/>
		</choice>
		<attribute name="author" type="string" use="required"/>
		<attribute name="year" type="string" use="required"/>
		<attribute name="title" type="string" use="required"/>
		<attribute name="journal" type="string" use="required"/>
		<attribute name="identification" type="string" use="required"/>
	</complexType>
	<complexType name="DateTimeComplexType">
		<attribute name="date" type="AutXML:dateType" use="required"/>
	</complexType>
	<simpleType name="dateType">
		<restriction base="date">
			<pattern value="\d\d\d\d-\d\d-\d\d"/>
		</restriction>
	</simpleType>
	<simpleType name="TypeSingleType">
		<restriction base="string">
			<enumeration value="scalar"/>
			<enumeration value="categorical"/>
			<enumeration value="range / categorical"/>
			<enumeration value="ranges"/>
		</restriction>
	</simpleType>
	<simpleType name="ExternalIntegerSimpleType">
		<union memberTypes="integer">
			<simpleType>
				<restriction base="string">
					<pattern value="[$][a-zA-Z0-9.()*/+-_]+[$]"/>
				</restriction>
			</simpleType>
		</union>
	</simpleType>
</schema>
