<AutecologyXML xmlns="http://www.wldelft.nl/fews" xmlns:xsi="http://www.w3.org/2001/XMLSchema-instance" xsi:schemaLocation="http://www.wldelft.nl/fews ../../../XMLSchema/AutecologyXML.xsd">
	<Topic>
		<Species>
			<EoLpagenr>49941532</EoLpagenr>
			<LatName>Phocaena phocaena</LatName>
			<CommonNames>
				<Name name="Bruinvis" language="NL"/>
			</CommonNames>
			<SpecCode/>
		</Species>
	</Topic>
	<Autecology>
		<ModelType name="HSI">
			<System name="adult">
				<Scope>
					<SpatialScope>
						<GeoNames name="Netherlands" id="2750405"/>
					</SpatialScope>
					<TemporalScope>
						<StartDate>2008-01-01</StartDate>
						<EndDate>2009-01-01</EndDate>
					</TemporalScope>
				</Scope>
				<SystemDescription>
					<Description language="NL">
						<text>&lt;h1 id="Bruinvis-Phocaenaphocaena-Onzekerheidenvalidatie"&gt;Onzekerheid en validatie&lt;/h1&gt;&lt;p&gt;&lt;img class="emoticon emoticon-warning" src="./Bruinvis - Phocaena phocaena - HABITAT - Spatial analysis tool - Deltares Public Wiki_files/warning.svg" data-emoticon-name="warning" alt="(warning)"&gt; Deze dosis-effect relatie is niet gevalideerd.&lt;/p&gt;&lt;h1 id="Bruinvis-Phocaenaphocaena-Toepasbaarheid"&gt;Toepasbaarheid&lt;/h1&gt;&lt;p&gt;Er is weinig informatie beschikbaar over de Bruinvis om dosis-effect relaties op te baseren. Zo is het gebruik van zogenaamde visserij met staand want (waarbij de dieren in de netten verstrikt raken en verdrinken) zeer waarschijnlijk de oorzaak van de achteruitgang van de Bruinvis in de Noordzee &lt;a href="https://publicwiki.deltares.nl/display/HBTHOME/Bruinvis+-+Phocaena+phocaena#Bruinvis-Phocaenaphocaena-1"&gt;#1&lt;/a&gt;. Het maken van een kwantitatieve dosis-effect relatie met betrekking tot visserij is echter lastig. Ook kan watervervuiling een bedreiging vormen voor de Bruinvis. Milieuvervuilende stoffen zijn gemeten in bruinvissen, waarschijnlijk omdat ze voornamelijk langs kusten leven. Milieuvervuiling wordt gezien als een reden voor de recente vermindering in aantallen bruinvissen in Europa en delen van Noord-Amerika &lt;a href="https://publicwiki.deltares.nl/display/HBTHOME/Bruinvis+-+Phocaena+phocaena#Bruinvis-Phocaenaphocaena-2"&gt;#2&lt;/a&gt;.&lt;br&gt;De huidige dosis-effect relatie is van toepassing op de Noordzee.&lt;/p&gt;&lt;h1 id="Bruinvis-Phocaenaphocaena-Voorbeeldproject"&gt;Voorbeeld project&lt;/h1&gt;&lt;p&gt;Er is geen voorbeeldprojekt beschikbaar.&lt;/p&gt;</text>
					</Description>
				</SystemDescription>
				<SystemFlowDiagrams>
					<FlowDiagram name="adult">
						<From name="habitatgeschiktheid">
							<label>"habitatgeschiktheid"</label>
							<equation>min</equation>
							<To>waterdiepte</To>
						</From>
					</FlowDiagram>
				</SystemFlowDiagrams>
				<KnowledgeRules>
					<ResponseCurve name="waterdiepte">
						<inputLayers>
							<layer name="waterdiepte">
								<parameter_cat>TOBEFILLED</parameter_cat>
								<layer_filename>waterdiepte</layer_filename>
								<unit>"m"</unit>
								<statistic>minimum</statistic>
								<description>TOBEFILLED</description>
							</layer>
						</inputLayers>
						<Content>
							<type>ranges</type>
							<description>"Waterdiepte"</description>
							<author>"Marjolijn Haasnoot"</author>
							<date>2009-01-01</date>
							<references>
								<reference author="" year="2009" title="http://www.minlnv.nl/natura2000" journal="" identification=""/>
							</references>
							<valuesRanges>
								<parameter rangemin_input="0" rangemax_input="200" output="1"/>
								<parameter rangemin_input="200" rangemax_input="999" output="0"/>
							</valuesRanges>
						</Content>
						<outputLayers>
							<layer name="HSI_waterdiepte">
								<parameter_cat>HSI</parameter_cat>
								<layer_filename>HSI_waterdiepte</layer_filename>
								<unit>factor</unit>
								<statistic>average</statistic>
								<description>TOBEFILLED</description>
							</layer>
						</outputLayers>
					</ResponseCurve>
				</KnowledgeRules>
			</System>
		</ModelType>
	</Autecology>
	<TopicDescription>
		<Description language="NL">
			<text>&lt;h3 id="Bruinvis-Phocaenaphocaena-Algemeenvoorkomen"&gt;Algemeen voorkomen&lt;/h3&gt;&lt;p&gt;De Bruinvis (Phocoena phocoena; familie Phocaenidae) is de kleinste walvissoort in de Europese kustwateren. Bruinvissen zijn robuust van bouw en hebben in tegenstelling tot de meeste andere dolfijnen een afgeronde kop met een stompe snuit. Volwassen dieren zijn gemiddeld zo'n 1,5 m lang. De rugvin is klein en driehoekig van vorm. De rug is bruinachtig donkergrijs tot zwart (vandaar de naam), de onderzijde is wit en de flanken zijn grijs. Tussen de mondhoeken en de flippers bevindt zich een dunne zwarte streep. De soort weegt gemiddeld 50 tot 55 kg en maximaal 90 kg; mannetjes zijn iets forser dan vrouwtjes. De Bruinvis kan verward worden met de Tuimelaar (&lt;em&gt;Tursiops truncatus&lt;/em&gt;) doordat bij beide soorten kleurpatronen ontbreken. De Tuimelaar onderscheidt zich echter door zijn grotere formaat, zijn sikkelvormig gebogen rugvin en zijn lange snuit. Hij is bovendien veel zeldzamer dan bruinvissen in ons kustgebied, net als andere walvisachtigen. De Bruinvis wordt in relatief ondiep (tot 200 m) water waargenomen langs kusten en in baaien en gaat ook af en toe rivieren op. De soort leeft solitair of in kleine groepen, maar soms worden scholen van 50 tot 100 individuen gezien. De dieren communiceren onderling door middel van geluiden. Net als andere dolfijnen maken ze gebruik van echolocatie om te navigeren en te foerageren. Bruinvissen gebruiken hierbij zeer specifieke klikklanken &lt;a href="https://publicwiki.deltares.nl/display/HBTHOME/Bruinvis+-+Phocaena+phocaena#Bruinvis-Phocaenaphocaena-1"&gt;#1&lt;/a&gt;.&lt;/p&gt;&lt;h3 id="Bruinvis-Phocaenaphocaena-Voedselhabitatenstrategie"&gt;Voedselhabitat en strategie&lt;/h3&gt;&lt;p&gt;Het voedsel bestaat uit vissen, zoals Wijting (&lt;em&gt;Merlangius merlangus&lt;/em&gt;), Kabeljauw (&lt;em&gt;Gadus morhua&lt;/em&gt;), Puitaal (&lt;em&gt;Zoarces viviparus&lt;/em&gt;) en Haring (&lt;em&gt;Clupea harengus&lt;/em&gt;) en bijvoorbeeld inktvissen &lt;a href="https://publicwiki.deltares.nl/display/HBTHOME/Bruinvis+-+Phocaena+phocaena#Bruinvis-Phocaenaphocaena-1"&gt;#1&lt;/a&gt;.&lt;/p&gt;&lt;h3 id="Bruinvis-Phocaenaphocaena-Reproductieenmigratie"&gt;Reproductie en migratie&lt;/h3&gt;&lt;p&gt;De paartijd is in de zomer (juli), waarna tussen mei en juli van het volgende jaar één jong wordt geboren &lt;a href="https://publicwiki.deltares.nl/display/HBTHOME/Bruinvis+-+Phocaena+phocaena#Bruinvis-Phocaenaphocaena-1"&gt;#1&lt;/a&gt;.&lt;/p&gt;&lt;h3 id="Bruinvis-Phocaenaphocaena-Leeftijdenmortaliteit"&gt;Leeftijd en mortaliteit&lt;/h3&gt;&lt;p&gt;De Bruinvis kan 24 jaar oud worden maar het merendeel van de bruinvissen wordt waarschijnlijk niet ouder dan 12 jaar &lt;a href="https://publicwiki.deltares.nl/display/HBTHOME/Bruinvis+-+Phocaena+phocaena#Bruinvis-Phocaenaphocaena-1"&gt;#1&lt;/a&gt;.&lt;/p&gt;</text>
		</Description>
	</TopicDescription>
	<Documentation>
		<reference author="" year="2009" title="http://www.minlnv.nl/natura2000" journal="" identification="">
			<html>https://www.synbiosys.alterra.nl/natura2000/gebiedendatabase.aspx?zoek_gebiedsnaam_n2k=bruinvis</html>
		</reference>
		<reference author="" year="2009" title="http://www.soortenbank.nl" journal="" identification="">
			<html>http://www.soortenbank.nl/soorten.php?soortengroep=duikgids&amp;id=274&amp;menuentry=soorten</html>
		</reference>
	</Documentation>
	<DataSources/>
</AutecologyXML>
